0,Football Jersey: Manchester United,FJR,20,5,MU_3rd.jpg
0,Football Jersey: Cristiano Ronaldo,FJR,30,7,Cristiano_ronaldo_jersey.jpg
0,Football Jersey: Lionel Messi,FJR,23,5,Lionel_messi_jersey.jpg
0,Basketball Jersey: James of Lakers,BJR,14,4,Lebron_james_jersey.jpg
0,NFL Jersey: Tom Brady of Buccs,AJR,17,5,Tom_brady_jersey.jpg
0,NFL Jersey: Mahomes of Chiefs,AJR,9,3,Patrick_mahomes_jersey.jpg
0,Football boots: Adidas Predators,BTS,12,6,adidas_boots.jpg
0,Football boots: Nemeziz Spiderman,BTS,15,7,nemeziz_spiderman_boots.jpg
0,Football boots: Adidas Laceless,BTS,14,4,new_adidas_cool_boots.jpg
0,Football boots: Nike CR7,BTS,18,7,nike_ronaldo_boots.jpg
0,Football Socks: Adidas Socks,SCK,7,10,adidas_football_socks.jpg
0,Football: Champions League,SBL,10,8,champions_league_ball.jpg
0,Basketball: Wilson Crossover,SBL,7,3,basketball.jpg
0,American Football: NFL Superbowl,SBL,6,2,nfl_ball.jpg